InvoiceNo;StockCode;Description;Quantity;InvoiceDate;UnitPrice;CustomerID;Country
563614;23167;SMALL CERAMIC TOP STORAGE JAR ;48;18/08/2011 8:51;0,83;12415;Australia
563614;21731;RED TOADSTOOL LED NIGHT LIGHT;432;18/08/2011 8:51;1,45;12415;Australia
563614;22557;PLASTERS IN TIN VINTAGE PAISLEY ;96;18/08/2011 8:51;1,45;12415;Australia
563614;22551;PLASTERS IN TIN SPACEBOY;96;18/08/2011 8:51;1,45;12415;Australia
563614;22544;MINI JIGSAW SPACEBOY;240;18/08/2011 8:51;0,36;12415;Australia
563614;21915;RED  HARMONICA IN BOX ;240;18/08/2011 8:51;1,06;12415;Australia
563614;21914;BLUE HARMONICA IN BOX ;240;18/08/2011 8:51;1,06;12415;Australia
563614;22273;FELTCRAFT DOLL MOLLY;48;18/08/2011 8:51;2,55;12415;Australia
563614;22749;FELTCRAFT PRINCESS CHARLOTTE DOLL;48;18/08/2011 8:51;3,39;12415;Australia
563614;22619;SET OF 6 SOLDIER SKITTLES;160;18/08/2011 8:51;3,39;12415;Australia
563614;22139;RETROSPOT TEA SET CERAMIC 11 PC ;24;18/08/2011 8:51;4,25;12415;Australia
563614;23193;BUFFALO BILL TREASURE BOOK BOX;216;18/08/2011 8:51;1,95;12415;Australia
563614;23194;GYMKHANA TREASURE BOOK BOX;216;18/08/2011 8:51;2,25;12415;Australia
563614;23176;ABC TREASURE BOOK BOX ;72;18/08/2011 8:51;1,95;12415;Australia
563614;23177;TREASURE ISLAND BOOK BOX;216;18/08/2011 8:51;1,95;12415;Australia
563614;22147;FELTCRAFT BUTTERFLY HEARTS;80;18/08/2011 8:51;1,25;12415;Australia
563614;22150;3 STRIPEY MICE FELTCRAFT;80;18/08/2011 8:51;1,65;12415;Australia
563614;21715;GIRLS VINTAGE TIN SEASIDE BUCKET;32;18/08/2011 8:51;2,1;12415;Australia
563614;21716;BOYS VINTAGE TIN SEASIDE BUCKET;32;18/08/2011 8:51;2,1;12415;Australia
563614;21058;PARTY INVITES WOODLAND;48;18/08/2011 8:51;0,85;12415;Australia
563614;22326;ROUND SNACK BOXES SET OF4 WOODLAND ;96;18/08/2011 8:51;2,55;12415;Australia
563614;23550;WRAP ALPHABET POSTER  ;200;18/08/2011 8:51;0,34;12415;Australia
563614;23545;WRAP RED VINTAGE DOILY;200;18/08/2011 8:51;0,34;12415;Australia
563614;21197;MULTICOLOUR  CONFETTI IN TUBE;48;18/08/2011 8:51;1,45;12415;Australia
563614;21196;ROUND WHITE CONFETTI IN TUBE;24;18/08/2011 8:51;1,65;12415;Australia
563614;21198;WHITE HEART CONFETTI IN TUBE;24;18/08/2011 8:51;1,65;12415;Australia
563614;21199;PINK  HEART CONFETTI IN TUBE;24;18/08/2011 8:51;1,65;12415;Australia
563614;23314;VINTAGE CHRISTMAS TABLECLOTH;100;18/08/2011 8:51;10,39;12415;Australia
563614;22736;RIBBON REEL MAKING SNOWMEN ;120;18/08/2011 8:51;1,45;12415;Australia
563614;23312;VINTAGE CHRISTMAS GIFT SACK;100;18/08/2011 8:51;3,75;12415;Australia
563614;22735;RIBBON REEL SOCKS AND MITTENS;120;18/08/2011 8:51;1,45;12415;Australia
563614;22738;RIBBON REEL SNOWY VILLAGE;120;18/08/2011 8:51;1,45;12415;Australia
563614;22739;RIBBON REEL CHRISTMAS SOCK BAUBLE;120;18/08/2011 8:51;1,45;12415;Australia
563614;22950;36 DOILIES VINTAGE CHRISTMAS;288;18/08/2011 8:51;1,25;12415;Australia
563614;22909;SET OF 20 VINTAGE CHRISTMAS NAPKINS;288;18/08/2011 8:51;0,72;12415;Australia
563614;22952;60 CAKE CASES VINTAGE CHRISTMAS;240;18/08/2011 8:51;0,42;12415;Australia
563614;22910;PAPER CHAIN KIT VINTAGE CHRISTMAS;80;18/08/2011 8:51;2,55;12415;Australia
563614;23234;BISCUIT TIN VINTAGE CHRISTMAS;216;18/08/2011 8:51;2,49;12415;Australia
563614;21905;MORE BUTTER METAL SIGN ;12;18/08/2011 8:51;0,79;12415;Australia
565145;22751;FELTCRAFT PRINCESS OLIVIA DOLL;240;01/09/2011 13:50;3,39;12415;Australia
565145;21915;RED  HARMONICA IN BOX ;720;01/09/2011 13:50;1,06;12415;Australia
565145;22492;MINI PAINT SET VINTAGE ;1152;01/09/2011 13:50;0,55;12415;Australia
565145;23349;ROLL WRAP VINTAGE CHRISTMAS;60;01/09/2011 13:50;1,25;12415;Australia
565145;23445;ICE CREAM BUBBLES;200;01/09/2011 13:50;0,72;12415;Australia
565145;22818;CARD CHRISTMAS VILLAGE;72;01/09/2011 13:50;0,36;12415;Australia
565145;23077;DOUGHNUT LIP GLOSS ;200;01/09/2011 13:50;1,04;12415;Australia
565145;22621;TRADITIONAL KNITTING NANCY;48;01/09/2011 13:50;1,45;12415;Australia
565146;21891;TRADITIONAL WOODEN SKIPPING ROPE;144;01/09/2011 13:51;1,45;12415;Australia
565466;23206;LUNCH BAG APPLE DESIGN;10;05/09/2011 9:48;1,65;12422;Australia
565466;23208;LUNCH BAG VINTAGE LEAF DESIGN;10;05/09/2011 9:48;1,65;12422;Australia
565466;23209;LUNCH BAG VINTAGE DOILY ;10;05/09/2011 9:48;1,65;12422;Australia
565466;23344;JUMBO BAG 50'S CHRISTMAS ;10;05/09/2011 9:48;2,08;12422;Australia
565466;23199;JUMBO BAG APPLES;10;05/09/2011 9:48;2,08;12422;Australia
565466;23200;JUMBO BAG PEARS;10;05/09/2011 9:48;2,08;12422;Australia
565466;23202;JUMBO BAG VINTAGE LEAF;10;05/09/2011 9:48;2,08;12422;Australia
565466;23267;SET OF 4 SANTA PLACE SETTINGS;12;05/09/2011 9:48;1,25;12422;Australia
567085;21993;FLORAL FOLK STATIONERY SET;12;16/09/2011 12:38;1,25;12434;Australia
567085;23238;SET OF 4 KNICK KNACK TINS LONDON ;6;16/09/2011 12:38;4,15;12434;Australia
567085;23240;SET OF 4 KNICK KNACK TINS DOILY ;6;16/09/2011 12:38;4,15;12434;Australia
567085;23285;PINK VINTAGE SPOT BEAKER;16;16/09/2011 12:38;0,85;12434;Australia
567085;23286;BLUE VINTAGE SPOT BEAKER;16;16/09/2011 12:38;0,85;12434;Australia
567085;23287;RED VINTAGE SPOT BEAKER;16;16/09/2011 12:38;0,85;12434;Australia
567085;22983;CARD BILLBOARD FONT;12;16/09/2011 12:38;0,42;12434;Australia
567085;22716;CARD CIRCUS PARADE;12;16/09/2011 12:38;0,42;12434;Australia
567085;22024;RAINY LADIES BIRTHDAY CARD;12;16/09/2011 12:38;0,42;12434;Australia
567085;21086;SET/6 RED SPOTTY PAPER CUPS;12;16/09/2011 12:38;0,65;12434;Australia
567085;21194;PINK  HONEYCOMB PAPER FAN;12;16/09/2011 12:38;0,65;12434;Australia
567085;21202;DOLLY HONEYCOMB GARLAND;12;16/09/2011 12:38;1,65;12434;Australia
567085;21204;DAISIES  HONEYCOMB GARLAND ;12;16/09/2011 12:38;1,65;12434;Australia
567085;23293;SET OF 12 FAIRY CAKE BAKING CASES;16;16/09/2011 12:38;0,83;12434;Australia
567085;23296;SET OF 6 TEA TIME BAKING CASES;8;16/09/2011 12:38;1,25;12434;Australia
567085;23294;SET OF 6 SNACK LOAF BAKING CASES;8;16/09/2011 12:38;0,83;12434;Australia
567085;23295;SET OF 12 MINI LOAF BAKING CASES;16;16/09/2011 12:38;0,83;12434;Australia
567085;23328;SET 6 SCHOOL MILK BOTTLES IN CRATE;12;16/09/2011 12:38;3,75;12434;Australia
567085;23395;BELLE JARDINIERE CUSHION COVER;4;16/09/2011 12:38;3,75;12434;Australia
567085;20838;FRENCH LATTICE CUSHION COVER ;12;16/09/2011 12:38;0,85;12434;Australia
567085;21208;PASTEL COLOUR HONEYCOMB FAN;12;16/09/2011 12:38;0,39;12434;Australia
567085;21990;MODERN FLORAL STATIONERY SET;12;16/09/2011 12:38;1,25;12434;Australia
567085;22379;RECYCLING BAG RETROSPOT ;5;16/09/2011 12:38;2,1;12434;Australia
567085;22381;TOY TIDY PINK POLKADOT;5;16/09/2011 12:38;2,1;12434;Australia
567085;21922;UNION STRIPE WITH FRINGE  HAMMOCK;2;16/09/2011 12:38;7,95;12434;Australia
567085;23236;STORAGE TIN VINTAGE DOILY ;6;16/09/2011 12:38;2,89;12434;Australia
567085;22786;CUSHION COVER PINK UNION JACK;4;16/09/2011 12:38;5,95;12434;Australia
567085;22128;PARTY CONES CANDY ASSORTED;24;16/09/2011 12:38;1,25;12434;Australia
567085;23298;SPOTTY BUNTING;3;16/09/2011 12:38;4,95;12434;Australia
567085;20749;ASSORTED COLOUR MINI CASES;2;16/09/2011 12:38;7,95;12434;Australia
567085;20750;RED RETROSPOT MINI CASES;2;16/09/2011 12:38;7,95;12434;Australia
567085;48138;DOORMAT UNION FLAG;2;16/09/2011 12:38;8,25;12434;Australia
567085;21623;VINTAGE UNION JACK MEMOBOARD;2;16/09/2011 12:38;9,95;12434;Australia
567085;22505;MEMO BOARD COTTAGE DESIGN;4;16/09/2011 12:38;4,95;12434;Australia
568145;23326;HANGING MINI COLOURED BOTTLES;96;25/09/2011 11:30;0,63;12388;Australia
568145;23327;HANGING CLEAR MINI BOTTLE;48;25/09/2011 11:30;0,63;12388;Australia
568145;23324;RUSTIC STRAWBERRY JAM POT LARGE ;12;25/09/2011 11:30;2,08;12388;Australia
568145;23325;RUSTIC STRAWBERRY JAM POT SMALL;12;25/09/2011 11:30;1,65;12388;Australia
568145;23328;SET 6 SCHOOL MILK BOTTLES IN CRATE;24;25/09/2011 11:30;3,39;12388;Australia
568145;23433;HANGING QUILTED PATCHWORK APPLES;24;25/09/2011 11:30;0,83;12388;Australia
568145;22669;RED BABY BUNTING ;5;25/09/2011 11:30;2,95;12388;Australia
568145;47566;PARTY BUNTING;12;25/09/2011 11:30;4,95;12388;Australia
568145;47590B;PINK HAPPY BIRTHDAY BUNTING;3;25/09/2011 11:30;5,45;12388;Australia
568145;22720;SET OF 3 CAKE TINS PANTRY DESIGN ;16;25/09/2011 11:30;4,25;12388;Australia
568145;23245;SET OF 3 REGENCY CAKE TINS;8;25/09/2011 11:30;4,95;12388;Australia
568145;23024;LARGE BONNE JAM JAR  T-LIGHT HOLDER;6;25/09/2011 11:30;2,89;12388;Australia
568145;84970L;SINGLE HEART ZINC T-LIGHT HOLDER;36;25/09/2011 11:30;1,25;12388;Australia
568145;84970S;HANGING HEART ZINC T-LIGHT HOLDER;36;25/09/2011 11:30;0,85;12388;Australia
568145;84978;HANGING HEART JAR T-LIGHT HOLDER;24;25/09/2011 11:30;1,25;12388;Australia
568145;22478;BIRDHOUSE GARDEN MARKER ;50;25/09/2011 11:30;1,25;12388;Australia
568145;22495;SET OF 2 ROUND TINS CAMEMBERT ;6;25/09/2011 11:30;2,95;12388;Australia
568145;22496;SET OF 2 ROUND TINS DUTCH CHEESE;6;25/09/2011 11:30;2,95;12388;Australia
568145;23236;STORAGE TIN VINTAGE DOILY ;18;25/09/2011 11:30;2,89;12388;Australia
568145;22086;PAPER CHAIN KIT 50'S CHRISTMAS ;12;25/09/2011 11:30;2,95;12388;Australia
568145;22910;PAPER CHAIN KIT VINTAGE CHRISTMAS;12;25/09/2011 11:30;2,95;12388;Australia
568145;22722;SET OF 6 SPICE TINS PANTRY DESIGN;12;25/09/2011 11:30;3,95;12388;Australia
568687;22090;PAPER BUNTING RETROSPOT;12;28/09/2011 14:26;2,95;16321;Australia
568687;21198;WHITE HEART CONFETTI IN TUBE;24;28/09/2011 14:26;1,65;16321;Australia
568695;22090;PAPER BUNTING RETROSPOT;12;28/09/2011 14:55;2,95;16321;Australia
568695;21198;WHITE HEART CONFETTI IN TUBE;24;28/09/2011 14:55;1,65;16321;Australia
C568694;22090;PAPER BUNTING RETROSPOT;-12;28/09/2011 14:55;2,95;16321;Australia
C568694;21198;WHITE HEART CONFETTI IN TUBE;-24;28/09/2011 14:55;1,65;16321;Australia
568708;22379;RECYCLING BAG RETROSPOT ;10;28/09/2011 15:41;2,1;12393;Australia
568708;22619;SET OF 6 SOLDIER SKITTLES;8;28/09/2011 15:41;3,75;12393;Australia
568708;21915;RED  HARMONICA IN BOX ;12;28/09/2011 15:41;1,25;12393;Australia
568708;21213;PACK OF 72 SKULL CAKE CASES;24;28/09/2011 15:41;0,55;12393;Australia
568708;22331;WOODLAND PARTY BAG + STICKER SET;16;28/09/2011 15:41;1,65;12393;Australia
568708;20726;LUNCH BAG WOODLAND;30;28/09/2011 15:41;1,65;12393;Australia
568708;21581;SKULLS  DESIGN  COTTON TOTE BAG;6;28/09/2011 15:41;2,25;12393;Australia
568708;21933;PINK VINTAGE PAISLEY PICNIC BAG;10;28/09/2011 15:41;1,65;12393;Australia
568708;21932;SCANDINAVIAN PAISLEY PICNIC BAG;10;28/09/2011 15:41;1,65;12393;Australia
568708;20728;LUNCH BAG CARS BLUE;20;28/09/2011 15:41;1,65;12393;Australia
568708;20725;LUNCH BAG RED RETROSPOT;10;28/09/2011 15:41;1,65;12393;Australia
568708;22384;LUNCH BAG PINK POLKADOT;10;28/09/2011 15:41;1,65;12393;Australia
568708;22620;4 TRADITIONAL SPINNING TOPS;12;28/09/2011 15:41;1,45;12393;Australia
568708;21976;PACK OF 60 MUSHROOM CAKE CASES;24;28/09/2011 15:41;0,55;12393;Australia
568708;21058;PARTY INVITES WOODLAND;12;28/09/2011 15:41;0,85;12393;Australia
568708;22380;TOY TIDY SPACEBOY  ;10;28/09/2011 15:41;2,1;12393;Australia
568708;22466;FAIRY TALE COTTAGE NIGHT LIGHT;12;28/09/2011 15:41;1,95;12393;Australia
568708;21731;RED TOADSTOOL LED NIGHT LIGHT;12;28/09/2011 15:41;1,65;12393;Australia
568708;23388;WOODLAND MINI BACKPACK;8;28/09/2011 15:41;4,15;12393;Australia
568708;23389;SPACEBOY MINI BACKPACK;4;28/09/2011 15:41;4,15;12393;Australia
568708;22175;PINK OWL SOFT TOY;6;28/09/2011 15:41;2,95;12393;Australia
568708;20971;PINK BLUE FELT CRAFT TRINKET BOX;12;28/09/2011 15:41;1,25;12393;Australia
568708;23391; I LOVE LONDON MINI BACKPACK;4;28/09/2011 15:41;4,15;12393;Australia
568708;23390;DOLLY GIRL MINI BACKPACK;4;28/09/2011 15:41;4,15;12393;Australia
568708;23389;SPACEBOY MINI BACKPACK;8;28/09/2011 15:41;4,15;12393;Australia
569647;22722;SET OF 6 SPICE TINS PANTRY DESIGN;240;05/10/2011 12:35;3,45;12415;Australia
569650;23392;SPACEBOY ROCKET LOLLY MAKERS;96;05/10/2011 12:44;1,79;12415;Australia
569650;22722;SET OF 6 SPICE TINS PANTRY DESIGN;120;05/10/2011 12:44;3,45;12415;Australia
569650;23512;EMBROIDERED RIBBON REEL ROSIE;144;05/10/2011 12:44;1,79;12415;Australia
569650;23513;EMBROIDERED RIBBON REEL SUSIE ;144;05/10/2011 12:44;1,79;12415;Australia
569650;23519;EMBROIDERED RIBBON REEL CLAIRE;72;05/10/2011 12:44;3,29;12415;Australia
569650;23515;EMBROIDERED RIBBON REEL DAISY ;144;05/10/2011 12:44;1,79;12415;Australia
569650;23518;EMBROIDERED RIBBON REEL RACHEL ;96;05/10/2011 12:44;2,49;12415;Australia
569650;23516;EMBROIDERED RIBBON REEL SOPHIE  ;72;05/10/2011 12:44;3,29;12415;Australia
569650;23502;PLAYING CARDS VINTAGE DOILY ;100;05/10/2011 12:44;1,04;12415;Australia
569650;23505;PLAYING CARDS I LOVE LONDON ;100;05/10/2011 12:44;1,04;12415;Australia
569650;23507;MINI PLAYING CARDS BUFFALO BILL ;250;05/10/2011 12:44;0,36;12415;Australia
569650;23510;MINI PLAYING CARDS GYMKHANA;250;05/10/2011 12:44;0,36;12415;Australia
569650;22720;SET OF 3 CAKE TINS PANTRY DESIGN ;32;05/10/2011 12:44;4,25;12415;Australia
569650;22969;HOMEMADE JAM SCENTED CANDLES;192;05/10/2011 12:44;1,25;12415;Australia
569650;22978;PANTRY ROLLING PIN;48;05/10/2011 12:44;3,39;12415;Australia
569650;22907;PACK OF 20 NAPKINS PANTRY DESIGN;96;05/10/2011 12:44;0,72;12415;Australia
569650;22726;ALARM CLOCK BAKELIKE GREEN;50;05/10/2011 12:44;3,39;12415;Australia
569650;22728;ALARM CLOCK BAKELIKE PINK;50;05/10/2011 12:44;3,39;12415;Australia
569650;22730;ALARM CLOCK BAKELIKE IVORY;50;05/10/2011 12:44;3,39;12415;Australia
569650;22727;ALARM CLOCK BAKELIKE RED ;50;05/10/2011 12:44;3,39;12415;Australia
569650;22725;ALARM CLOCK BAKELIKE CHOCOLATE;50;05/10/2011 12:44;3,39;12415;Australia
569650;22191;IVORY DINER WALL CLOCK;12;05/10/2011 12:44;7,65;12415;Australia
569650;22193;RED DINER WALL CLOCK;12;05/10/2011 12:44;7,65;12415;Australia
569650;23342;MINT DINER WALL CLOCK;12;05/10/2011 12:44;7,65;12415;Australia
569650;22192;BLUE DINER WALL CLOCK;12;05/10/2011 12:44;7,65;12415;Australia
569650;23341;PINK DINER WALL CLOCK;12;05/10/2011 12:44;7,65;12415;Australia
569650;22892;SET OF SALT AND PEPPER TOADSTOOLS;72;05/10/2011 12:44;1,06;12415;Australia
569650;23113;PANTRY CHOPPING BOARD;36;05/10/2011 12:44;4,15;12415;Australia
569650;23114;VINTAGE LEAF CHOPPING BOARD  ;36;05/10/2011 12:44;4,15;12415;Australia
569650;23012;GLASS APOTHECARY BOTTLE PERFUME;12;05/10/2011 12:44;3,45;12415;Australia
569650;23014;GLASS APOTHECARY BOTTLE ELIXIR;12;05/10/2011 12:44;3,45;12415;Australia
569650;23013;GLASS APOTHECARY BOTTLE TONIC;12;05/10/2011 12:44;3,45;12415;Australia
569650;23524;HORSE & PONY WALL ART;48;05/10/2011 12:44;3,29;12415;Australia
569650;23527;ANIMALS AND NATURE WALL ART;48;05/10/2011 12:44;3,29;12415;Australia
569650;23525;BUFFALO BILL WALL ART ;48;05/10/2011 12:44;3,29;12415;Australia
569650;23523;TREASURE AHOY WALL ART;48;05/10/2011 12:44;3,29;12415;Australia
569650;23526;DOG LICENCE WALL ART;180;05/10/2011 12:44;5,35;12415;Australia
569650;23534;STOP FOR TEA WALL ART;180;05/10/2011 12:44;5,35;12415;Australia
569650;23535;BICYCLE SAFTEY WALL ART;180;05/10/2011 12:44;5,35;12415;Australia
569650;23536;VILLAGE SHOW WALL ART;180;05/10/2011 12:44;5,35;12415;Australia
569650;23541;WALL ART CLASSIC PUDDINGS ;48;05/10/2011 12:44;7,45;12415;Australia
569650;23542;70'S ALPHABET WALL ART;6;05/10/2011 12:44;7,45;12415;Australia
569650;23533;WALL ART GARDEN HAVEN ;36;05/10/2011 12:44;5,35;12415;Australia
569650;22386;JUMBO BAG PINK POLKADOT;100;05/10/2011 12:44;1,79;12415;Australia
569650;20711;JUMBO BAG TOYS ;100;05/10/2011 12:44;1,79;12415;Australia
569650;23206;LUNCH BAG APPLE DESIGN;100;05/10/2011 12:44;1,45;12415;Australia
569650;22631;CIRCUS PARADE LUNCH BOX ;192;05/10/2011 12:44;1,65;12415;Australia
569650;22629;SPACEBOY LUNCH BOX ;64;05/10/2011 12:44;1,65;12415;Australia
569650;22630;DOLLY GIRL LUNCH BOX;64;05/10/2011 12:44;1,65;12415;Australia
569650;23371;SET 36 COLOUR PENCILS SPACEBOY ;128;05/10/2011 12:44;1,06;12415;Australia
569650;23372;SET 36 COLOUR PENCILS DOLLY GIRL;128;05/10/2011 12:44;1,06;12415;Australia
569650;23370;SET 36 COLOURING PENCILS DOILY;128;05/10/2011 12:44;1,06;12415;Australia
569650;20979;36 PENCILS TUBE RED RETROSPOT;128;05/10/2011 12:44;1,06;12415;Australia
569650;20978;36 PENCILS TUBE SKULLS;128;05/10/2011 12:44;1,06;12415;Australia
569650;20727;LUNCH BAG  BLACK SKULL.;100;05/10/2011 12:44;1,45;12415;Australia
569650;23390;DOLLY GIRL MINI BACKPACK;100;05/10/2011 12:44;3,75;12415;Australia
569650;23389;SPACEBOY MINI BACKPACK;100;05/10/2011 12:44;3,75;12415;Australia
569650;23388;WOODLAND MINI BACKPACK;100;05/10/2011 12:44;3,75;12415;Australia
569650;22029;SPACEBOY BIRTHDAY CARD;72;05/10/2011 12:44;0,36;12415;Australia
569650;22539;MINI JIGSAW DOLLY GIRL;240;05/10/2011 12:44;0,36;12415;Australia
569650;22544;MINI JIGSAW SPACEBOY;240;05/10/2011 12:44;0,36;12415;Australia
569650;22546;MINI JIGSAW PURDEY;240;05/10/2011 12:44;0,36;12415;Australia
569650;23108;SET OF 10 LED DOLLY LIGHTS;60;05/10/2011 12:44;5,39;12415;Australia
569650;23236;STORAGE TIN VINTAGE DOILY ;48;05/10/2011 12:44;2,49;12415;Australia
569650;22698;PINK REGENCY TEACUP AND SAUCER;24;05/10/2011 12:44;2,55;12415;Australia
569650;22699;ROSES REGENCY TEACUP AND SAUCER ;24;05/10/2011 12:44;2,55;12415;Australia
569650;22423;REGENCY CAKESTAND 3 TIER;16;05/10/2011 12:44;10,95;12415;Australia
569650;23175;REGENCY MILK JUG PINK ;24;05/10/2011 12:44;2,75;12415;Australia
569650;23245;SET OF 3 REGENCY CAKE TINS;32;05/10/2011 12:44;4,15;12415;Australia
569650;21115;ROSE CARAVAN DOORSTOP;16;05/10/2011 12:44;5,95;12415;Australia
569650;21770;OPEN CLOSED METAL SIGN;36;05/10/2011 12:44;4,25;12415;Australia
569650;21539;RED RETROSPOT BUTTER DISH;3;05/10/2011 12:44;4,95;12415;Australia
569650;21843;RED RETROSPOT CAKE STAND;24;05/10/2011 12:44;9,95;12415;Australia
569650;23308;SET OF 60 VINTAGE LEAF CAKE CASES ;120;05/10/2011 12:44;0,42;12415;Australia
569650;22090;PAPER BUNTING RETROSPOT;40;05/10/2011 12:44;2,55;12415;Australia
569650;22549;PICTURE DOMINOES;72;05/10/2011 12:44;1,25;12415;Australia
569650;22620;4 TRADITIONAL SPINNING TOPS;48;05/10/2011 12:44;1,45;12415;Australia
569650;22991;GIRAFFE WOODEN RULER;144;05/10/2011 12:44;1,65;12415;Australia
569650;22992;REVOLVER WOODEN RULER ;144;05/10/2011 12:44;1,65;12415;Australia
569650;21791;VINTAGE HEADS AND TAILS CARD GAME ;72;05/10/2011 12:44;1,06;12415;Australia
569650;22327;ROUND SNACK BOXES SET OF 4 SKULLS;48;05/10/2011 12:44;2,55;12415;Australia
569722;23355;HOT WATER BOTTLE KEEP CALM;12;06/10/2011 9:31;4,95;12431;Australia
569722;23389;SPACEBOY MINI BACKPACK;4;06/10/2011 9:31;4,15;12431;Australia
569722;23392;SPACEBOY ROCKET LOLLY MAKERS;6;06/10/2011 9:31;2,08;12431;Australia
569722;85014A;BLACK/BLUE POLKADOT UMBRELLA;3;06/10/2011 9:31;5,95;12431;Australia
569722;85014B;RED RETROSPOT UMBRELLA;3;06/10/2011 9:31;5,95;12431;Australia
569722;21936;RED RETROSPOT PICNIC BAG;5;06/10/2011 9:31;2,95;12431;Australia
569722;22385;JUMBO BAG SPACEBOY DESIGN;20;06/10/2011 9:31;2,08;12431;Australia
569722;20712;JUMBO BAG WOODLAND ANIMALS;10;06/10/2011 9:31;2,08;12431;Australia
569722;23559;WOODLAND BUNNIES LOLLY MAKERS;6;06/10/2011 9:31;2,08;12431;Australia
569722;22423;REGENCY CAKESTAND 3 TIER;4;06/10/2011 9:31;12,75;12431;Australia
569722;16169E;WRAP 50'S  CHRISTMAS;25;06/10/2011 9:31;0,42;12431;Australia
569722;22045;SPACEBOY GIFT WRAP;25;06/10/2011 9:31;0,42;12431;Australia
569722;22726;ALARM CLOCK BAKELIKE GREEN;12;06/10/2011 9:31;3,75;12431;Australia
569722;22193;RED DINER WALL CLOCK;4;06/10/2011 9:31;8,5;12431;Australia
569722;22727;ALARM CLOCK BAKELIKE RED ;12;06/10/2011 9:31;3,75;12431;Australia
569722;23316;RED REFECTORY CLOCK ;2;06/10/2011 9:31;9,95;12431;Australia
569722;23342;MINT DINER WALL CLOCK;2;06/10/2011 9:31;8,5;12431;Australia
569722;22690;DOORMAT HOME SWEET HOME BLUE ;4;06/10/2011 9:31;8,25;12431;Australia
569722;23502;PLAYING CARDS VINTAGE DOILY ;12;06/10/2011 9:31;1,25;12431;Australia
569722;23506;MINI PLAYING CARDS SPACEBOY ;20;06/10/2011 9:31;0,42;12431;Australia
569722;23298;SPOTTY BUNTING;3;06/10/2011 9:31;4,95;12431;Australia
569722;23245;SET OF 3 REGENCY CAKE TINS;4;06/10/2011 9:31;4,95;12431;Australia
569722;22029;SPACEBOY BIRTHDAY CARD;12;06/10/2011 9:31;0,42;12431;Australia
569722;22037;ROBOT BIRTHDAY CARD;12;06/10/2011 9:31;0,42;12431;Australia
569722;21770;OPEN CLOSED METAL SIGN;2;06/10/2011 9:31;4,95;12431;Australia
569722;21164;HOME SWEET HOME METAL SIGN ;6;06/10/2011 9:31;2,95;12431;Australia
569722;21243;PINK  POLKADOT PLATE ;8;06/10/2011 9:31;1,69;12431;Australia
569723;20712;JUMBO BAG WOODLAND ANIMALS;10;06/10/2011 9:32;2,08;12431;Australia
569723;23108;SET OF 10 LED DOLLY LIGHTS;2;06/10/2011 9:32;6,25;12431;Australia
569723;22411;JUMBO SHOPPER VINTAGE RED PAISLEY;10;06/10/2011 9:32;2,08;12431;Australia
569723;85014B;RED RETROSPOT UMBRELLA;3;06/10/2011 9:32;5,95;12431;Australia
569723;85014A;BLACK/BLUE POLKADOT UMBRELLA;3;06/10/2011 9:32;5,95;12431;Australia
574014;23247;BISCUIT TIN 50'S CHRISTMAS;216;02/11/2011 12:03;2,89;12415;Australia
C574019;22738;RIBBON REEL SNOWY VILLAGE;-120;02/11/2011 12:05;1,45;12415;Australia
574138;23157;SET OF 6 NATIVITY MAGNETS ;36;03/11/2011 11:26;2,08;12415;Australia
574138;23382;BOX OF 6 CHRISTMAS CAKE DECORATIONS;36;03/11/2011 11:26;3,29;12415;Australia
574138;23084;RABBIT NIGHT LIGHT;96;03/11/2011 11:26;1,79;12415;Australia
574138;22818;CARD CHRISTMAS VILLAGE;24;03/11/2011 11:26;0,42;12415;Australia
574138;23234;BISCUIT TIN VINTAGE CHRISTMAS;216;03/11/2011 11:26;0;12415;Australia
C574344;POST;POSTAGE;-1;04/11/2011 10:18;262,73;12415;Australia
574469;23084;RABBIT NIGHT LIGHT;336;04/11/2011 11:55;1,79;12431;Australia
574469;22385;JUMBO BAG SPACEBOY DESIGN;12;04/11/2011 11:55;0;12431;Australia
576394;20725;LUNCH BAG RED RETROSPOT;100;15/11/2011 10:32;1,45;12415;Australia
576394;22382;LUNCH BAG SPACEBOY DESIGN ;100;15/11/2011 10:32;1,45;12415;Australia
576394;22629;SPACEBOY LUNCH BOX ;64;15/11/2011 10:32;1,65;12415;Australia
576394;22630;DOLLY GIRL LUNCH BOX;64;15/11/2011 10:32;1,65;12415;Australia
576394;22631;CIRCUS PARADE LUNCH BOX ;64;15/11/2011 10:32;1,65;12415;Australia
576394;22384;LUNCH BAG PINK POLKADOT;100;15/11/2011 10:32;1,45;12415;Australia
576394;22662;LUNCH BAG DOLLY GIRL DESIGN;100;15/11/2011 10:32;1,45;12415;Australia
576394;23206;LUNCH BAG APPLE DESIGN;100;15/11/2011 10:32;1,45;12415;Australia
576394;23192;BUNDLE OF 3 ALPHABET EXERCISE BOOKS;48;15/11/2011 10:32;1,45;12415;Australia
576394;22326;ROUND SNACK BOXES SET OF4 WOODLAND ;96;15/11/2011 10:32;2,55;12415;Australia
576394;21068;VINTAGE BILLBOARD LOVE/HATE MUG;36;15/11/2011 10:32;1,06;12415;Australia
576394;23084;RABBIT NIGHT LIGHT;960;15/11/2011 10:32;1,79;12415;Australia
576394;22466;FAIRY TALE COTTAGE NIGHT LIGHT;96;15/11/2011 10:32;1,65;12415;Australia
576394;21731;RED TOADSTOOL LED NIGHT LIGHT;144;15/11/2011 10:32;1,45;12415;Australia
576394;22331;WOODLAND PARTY BAG + STICKER SET;48;15/11/2011 10:32;1,45;12415;Australia
576394;21770;OPEN CLOSED METAL SIGN;36;15/11/2011 10:32;4,25;12415;Australia
576394;47590A;BLUE HAPPY BIRTHDAY BUNTING;50;15/11/2011 10:32;4,65;12415;Australia
576394;47590B;PINK HAPPY BIRTHDAY BUNTING;50;15/11/2011 10:32;4,65;12415;Australia
576394;23480;MINI LIGHTS WOODLAND MUSHROOMS;48;15/11/2011 10:32;3,29;12415;Australia
576394;23497;CLASSIC CHROME BICYCLE BELL ;48;15/11/2011 10:32;1,25;12415;Australia
576394;22131;FOOD CONTAINER SET 3 LOVE HEART ;72;15/11/2011 10:32;1,65;12415;Australia
576394;22132;RED LOVE HEART SHAPE CUP;96;15/11/2011 10:32;0,72;12415;Australia
576394;22196;SMALL HEART MEASURING SPOONS;160;15/11/2011 10:32;0,72;12415;Australia
576394;22195;LARGE HEART MEASURING SPOONS;80;15/11/2011 10:32;1,45;12415;Australia
576394;48194;DOORMAT HEARTS;10;15/11/2011 10:32;7,08;12415;Australia
576394;84992;72 SWEETHEART FAIRY CAKE CASES;120;15/11/2011 10:32;0,42;12415;Australia
576586;23084;RABBIT NIGHT LIGHT;240;15/11/2011 14:22;1,79;12415;Australia
578459;22338;STAR DECORATION PAINTED ZINC ;96;24/11/2011 12:30;0,19;12388;Australia
578459;22600;CHRISTMAS RETROSPOT STAR WOOD;20;24/11/2011 12:30;0,85;12388;Australia
578459;22910;PAPER CHAIN KIT VINTAGE CHRISTMAS;20;24/11/2011 12:30;2,95;12388;Australia
578459;22086;PAPER CHAIN KIT 50'S CHRISTMAS ;20;24/11/2011 12:30;2,95;12388;Australia
578459;22340;NOEL GARLAND PAINTED ZINC ;24;24/11/2011 12:30;0,39;12388;Australia
578459;22576;SWALLOW WOODEN CHRISTMAS DECORATION;20;24/11/2011 12:30;0,85;12388;Australia
578459;22580;ADVENT CALENDAR GINGHAM SACK;12;24/11/2011 12:30;5,95;12388;Australia
578459;22669;RED BABY BUNTING ;12;24/11/2011 12:30;2,95;12388;Australia
