InvoiceNo;StockCode;Description;Quantity;InvoiceDate;UnitPrice;CustomerID;Country
536389;22941;CHRISTMAS LIGHTS 10 REINDEER;6;01/12/2010 10:03;8,5;12431;Australia
536389;21622;VINTAGE UNION JACK CUSHION COVER;8;01/12/2010 10:03;4,95;12431;Australia
536389;21791;VINTAGE HEADS AND TAILS CARD GAME ;12;01/12/2010 10:03;1,25;12431;Australia
536389;35004C;SET OF 3 COLOURED  FLYING DUCKS;6;01/12/2010 10:03;5,45;12431;Australia
536389;35004G;SET OF 3 GOLD FLYING DUCKS;4;01/12/2010 10:03;6,35;12431;Australia
536389;85014B;RED RETROSPOT UMBRELLA;6;01/12/2010 10:03;5,95;12431;Australia
536389;85014A;BLACK/BLUE POLKADOT UMBRELLA;3;01/12/2010 10:03;5,95;12431;Australia
536389;22193;RED DINER WALL CLOCK;2;01/12/2010 10:03;8,5;12431;Australia
536389;22726;ALARM CLOCK BAKELIKE GREEN;4;01/12/2010 10:03;3,75;12431;Australia
536389;22727;ALARM CLOCK BAKELIKE RED ;4;01/12/2010 10:03;3,75;12431;Australia
536389;22192;BLUE DINER WALL CLOCK;2;01/12/2010 10:03;8,5;12431;Australia
536389;22191;IVORY DINER WALL CLOCK;2;01/12/2010 10:03;8,5;12431;Australia
536389;22195;LARGE HEART MEASURING SPOONS;24;01/12/2010 10:03;1,65;12431;Australia
536389;22196;SMALL HEART MEASURING SPOONS;24;01/12/2010 10:03;0,85;12431;Australia
537676;22567;20 DOLLY PEGS RETROSPOT;24;08/12/2010 9:53;1,25;12386;Australia
537676;22915;ASSORTED BOTTLE TOP  MAGNETS ;120;08/12/2010 9:53;0,36;12386;Australia
537676;22926;IVORY GIANT GARDEN THERMOMETER;12;08/12/2010 9:53;5,95;12386;Australia
537676;22953;BIRTHDAY PARTY CORDON BARRIER TAPE;24;08/12/2010 9:53;1,25;12386;Australia
537676;21906;PHARMACIE FIRST AID TIN;4;08/12/2010 9:53;6,75;12386;Australia
537676;22495;SET OF 2 ROUND TINS CAMEMBERT ;6;08/12/2010 9:53;2,95;12386;Australia
537676;22555;PLASTERS IN TIN STRONGMAN;12;08/12/2010 9:53;1,65;12386;Australia
537676;22557;PLASTERS IN TIN VINTAGE PAISLEY ;12;08/12/2010 9:53;1,65;12386;Australia
C538723;22333;RETROSPOT PARTY BAG + STICKER SET;-7;14/12/2010 11:12;1,65;12434;Australia
C538723;22094;RED RETROSPOT TISSUE BOX;-5;14/12/2010 11:12;1,25;12434;Australia
C538723;21217;RED RETROSPOT ROUND CAKE TINS;-1;14/12/2010 11:12;9,95;12434;Australia
539419;48138;DOORMAT UNION FLAG;10;17/12/2010 14:10;6,75;12431;Australia
539419;79067;CORONA MEXICAN TRAY;50;17/12/2010 14:10;2,95;12431;Australia
539419;20725;LUNCH BAG RED RETROSPOT;10;17/12/2010 14:10;1,65;12431;Australia
539419;85099B;JUMBO BAG RED RETROSPOT;10;17/12/2010 14:10;1,95;12431;Australia
539419;22728;ALARM CLOCK BAKELIKE PINK;4;17/12/2010 14:10;3,75;12431;Australia
539419;22196;SMALL HEART MEASURING SPOONS;24;17/12/2010 14:10;0,85;12431;Australia
539419;22195;LARGE HEART MEASURING SPOONS;12;17/12/2010 14:10;1,65;12431;Australia
539419;22219;LOVEBIRD HANGING DECORATION WHITE ;12;17/12/2010 14:10;0,85;12431;Australia
539419;20685;DOORMAT RED RETROSPOT;4;17/12/2010 14:10;7,95;12431;Australia
539419;48138;DOORMAT UNION FLAG;10;17/12/2010 14:10;6,75;12431;Australia
540267;22078;RIBBON REEL LACE DESIGN ;120;06/01/2011 11:12;1,85;12415;Australia
540267;22079;RIBBON REEL HEARTS DESIGN ;120;06/01/2011 11:12;1,45;12415;Australia
540267;22080;RIBBON REEL POLKADOTS ;120;06/01/2011 11:12;1,45;12415;Australia
540267;22077;6 RIBBONS RUSTIC CHARM;144;06/01/2011 11:12;1,45;12415;Australia
540267;22505;MEMO BOARD COTTAGE DESIGN;24;06/01/2011 11:12;4,25;12415;Australia
540267;22516;CHILDS GARDEN RAKE BLUE;36;06/01/2011 11:12;1,85;12415;Australia
540267;22517;CHILDS GARDEN RAKE PINK;36;06/01/2011 11:12;1,85;12415;Australia
540267;22518;CHILDS GARDEN BRUSH BLUE;36;06/01/2011 11:12;1,85;12415;Australia
540267;22519;CHILDS GARDEN BRUSH PINK;36;06/01/2011 11:12;1,85;12415;Australia
540267;22514;CHILDS GARDEN SPADE BLUE;36;06/01/2011 11:12;1,85;12415;Australia
540267;22515;CHILDS GARDEN SPADE PINK;36;06/01/2011 11:12;1,85;12415;Australia
540267;22522;CHILDS GARDEN FORK BLUE ;192;06/01/2011 11:12;0,72;12415;Australia
540267;22524;CHILDRENS GARDEN GLOVES BLUE;100;06/01/2011 11:12;1,06;12415;Australia
540267;22525;CHILDRENS GARDEN GLOVES PINK;100;06/01/2011 11:12;1,06;12415;Australia
540267;22933;BAKING MOULD EASTER EGG MILK CHOC;6;06/01/2011 11:12;2,95;12415;Australia
540267;22934;BAKING MOULD EASTER EGG WHITE CHOC;48;06/01/2011 11:12;2,55;12415;Australia
540267;84218;BOX/12 CHICK & EGG IN BASKET;60;06/01/2011 11:12;1,69;12415;Australia
540267;84228;HEN HOUSE W CHICK STANDING;120;06/01/2011 11:12;0,37;12415;Australia
540267;22148;EASTER CRAFT 4 CHICKS ;40;06/01/2011 11:12;1,65;12415;Australia
540267;22857;ASSORTED EASTER GIFT TAGS;144;06/01/2011 11:12;0,72;12415;Australia
540267;22858;EASTER TIN KEEPSAKE;48;06/01/2011 11:12;1,65;12415;Australia
540267;22859;EASTER TIN BUNNY BOUQUET;48;06/01/2011 11:12;1,65;12415;Australia
540267;22860;EASTER TIN CHICKS PINK DAISY;48;06/01/2011 11:12;1,65;12415;Australia
540267;21915;RED  HARMONICA IN BOX ;240;06/01/2011 11:12;1,06;12415;Australia
540267;21914;BLUE HARMONICA IN BOX ;240;06/01/2011 11:12;1,06;12415;Australia
540267;22492;MINI PAINT SET VINTAGE ;576;06/01/2011 11:12;0,55;12415;Australia
540267;22619;SET OF 6 SOLDIER SKITTLES;80;06/01/2011 11:12;3,39;12415;Australia
540267;21891;TRADITIONAL WOODEN SKIPPING ROPE;144;06/01/2011 11:12;1,06;12415;Australia
540267;22620;4 TRADITIONAL SPINNING TOPS;160;06/01/2011 11:12;1,06;12415;Australia
540267;22659;LUNCH BOX I LOVE LONDON;64;06/01/2011 11:12;1,65;12415;Australia
540267;22720;SET OF 3 CAKE TINS PANTRY DESIGN ;240;06/01/2011 11:12;4,25;12415;Australia
540267;22722;SET OF 6 SPICE TINS PANTRY DESIGN;168;06/01/2011 11:12;3,45;12415;Australia
540267;22692;DOORMAT WELCOME TO OUR HOME;20;06/01/2011 11:12;6,75;12415;Australia
540267;20685;DOORMAT RED RETROSPOT;20;06/01/2011 11:12;6,75;12415;Australia
540267;22379;RECYCLING BAG RETROSPOT ;100;06/01/2011 11:12;1,85;12415;Australia
540267;22378;WALL TIDY RETROSPOT ;60;06/01/2011 11:12;0,85;12415;Australia
540267;22354;RETROSPOT PADDED SEAT CUSHION;60;06/01/2011 11:12;3,39;12415;Australia
540267;21243;PINK  POLKADOT PLATE ;96;06/01/2011 11:12;1,45;12415;Australia
540267;21244;BLUE POLKADOT PLATE ;96;06/01/2011 11:12;1,45;12415;Australia
540267;21242;RED RETROSPOT PLATE ;96;06/01/2011 11:12;1,45;12415;Australia
540267;21239;PINK  POLKADOT CUP;96;06/01/2011 11:12;0,72;12415;Australia
540267;21240;BLUE POLKADOT CUP;96;06/01/2011 11:12;0,72;12415;Australia
540267;20676;RED RETROSPOT BOWL;72;06/01/2011 11:12;1,06;12415;Australia
540267;20677;PINK POLKADOT BOWL;72;06/01/2011 11:12;1,06;12415;Australia
540267;21238;RED RETROSPOT CUP;96;06/01/2011 11:12;0,72;12415;Australia
540267;20675;BLUE POLKADOT BOWL;72;06/01/2011 11:12;1,06;12415;Australia
540280;21422;PORCELAIN ROSE SMALL;80;06/01/2011 12:37;0,85;12386;Australia
540280;21421;PORCELAIN ROSE LARGE ;60;06/01/2011 12:37;1,25;12386;Australia
540557;22523;CHILDS GARDEN FORK PINK;96;10/01/2011 9:58;0,85;12415;Australia
540700;21581;SKULLS  DESIGN  COTTON TOTE BAG;6;11/01/2011 9:47;2,25;12393;Australia
540700;22619;SET OF 6 SOLDIER SKITTLES;8;11/01/2011 9:47;3,75;12393;Australia
540700;84997B;RED 3 PIECE RETROSPOT CUTLERY SET;6;11/01/2011 9:47;3,75;12393;Australia
540700;20727;LUNCH BAG  BLACK SKULL.;20;11/01/2011 9:47;1,65;12393;Australia
540700;20726;LUNCH BAG WOODLAND;20;11/01/2011 9:47;1,65;12393;Australia
540700;22383;LUNCH BAG SUKI  DESIGN ;10;11/01/2011 9:47;1,65;12393;Australia
540700;21249;WOODLAND  HEIGHT CHART STICKERS ;6;11/01/2011 9:47;2,95;12393;Australia
540700;22378;WALL TIDY RETROSPOT ;20;11/01/2011 9:47;0,85;12393;Australia
540700;22175;PINK OWL SOFT TOY;12;11/01/2011 9:47;2,95;12393;Australia
540700;22176;BLUE OWL SOFT TOY;12;11/01/2011 9:47;2,95;12393;Australia
540700;84997C;BLUE 3 PIECE POLKADOT CUTLERY SET;6;11/01/2011 9:47;3,75;12393;Australia
540700;20728;LUNCH BAG CARS BLUE;20;11/01/2011 9:47;1,65;12393;Australia
540700;22382;LUNCH BAG SPACEBOY DESIGN ;20;11/01/2011 9:47;1,65;12393;Australia
540700;21915;RED  HARMONICA IN BOX ;12;11/01/2011 9:47;1,25;12393;Australia
540700;22549;PICTURE DOMINOES;12;11/01/2011 9:47;1,45;12393;Australia
540700;21578;WOODLAND DESIGN  COTTON TOTE BAG;12;11/01/2011 9:47;2,25;12393;Australia
540700;21577;SAVE THE PLANET COTTON TOTE BAG;12;11/01/2011 9:47;2,25;12393;Australia
540700;22245;HOOK, 1 HANGER ,MAGIC GARDEN;12;11/01/2011 9:47;0,85;12393;Australia
540700;22244;3 HOOK HANGER MAGIC GARDEN;12;11/01/2011 9:47;1,95;12393;Australia
541149;22449;SILK PURSE BABUSHKA PINK;6;14/01/2011 11:36;2,95;12393;Australia
541149;22450;SILK PURSE BABUSHKA BLUE;6;14/01/2011 11:36;2,95;12393;Australia
541149;22451;SILK PURSE BABUSHKA RED;48;14/01/2011 11:36;2,95;12393;Australia
541271;84970L;SINGLE HEART ZINC T-LIGHT HOLDER;12;17/01/2011 11:12;0,95;12388;Australia
541271;71459;HANGING JAM JAR T-LIGHT HOLDER;24;17/01/2011 11:12;0,85;12388;Australia
541271;22429;ENAMEL MEASURING JUG CREAM;4;17/01/2011 11:12;4,25;12388;Australia
541271;22262;FELT EGG COSY CHICKEN;12;17/01/2011 11:12;0,85;12388;Australia
541271;47590B;PINK HAPPY BIRTHDAY BUNTING;6;17/01/2011 11:12;5,45;12388;Australia
541271;47590A;BLUE HAPPY BIRTHDAY BUNTING;6;17/01/2011 11:12;5,45;12388;Australia
541271;22669;RED BABY BUNTING ;6;17/01/2011 11:12;2,95;12388;Australia
541271;22148;EASTER CRAFT 4 CHICKS ;12;17/01/2011 11:12;1,95;12388;Australia
541271;22957;SET 3 PAPER VINTAGE CHICK PAPER EGG;6;17/01/2011 11:12;2,95;12388;Australia
541271;47566;PARTY BUNTING;5;17/01/2011 11:12;4,65;12388;Australia
541271;22963;JAM JAR WITH GREEN LID;12;17/01/2011 11:12;0,85;12388;Australia
541271;22962;JAM JAR WITH PINK LID;12;17/01/2011 11:12;0,85;12388;Australia
541271;22961;JAM MAKING SET PRINTED;24;17/01/2011 11:12;1,45;12388;Australia
541271;22960;JAM MAKING SET WITH JARS;12;17/01/2011 11:12;3,75;12388;Australia
541271;22967;SET 3 SONG BIRD PAPER EGGS ASSORTED;6;17/01/2011 11:12;2,95;12388;Australia
541271;22310;IVORY KNITTED MUG COSY ;6;17/01/2011 11:12;1,65;12388;Australia
541271;22969;HOMEMADE JAM SCENTED CANDLES;24;17/01/2011 11:12;1,45;12388;Australia
541271;22722;SET OF 6 SPICE TINS PANTRY DESIGN;12;17/01/2011 11:12;3,95;12388;Australia
541271;22720;SET OF 3 CAKE TINS PANTRY DESIGN ;3;17/01/2011 11:12;4,95;12388;Australia
541520;20728;LUNCH BAG CARS BLUE;10;19/01/2011 9:13;1,65;12422;Australia
541520;20713;JUMBO BAG OWLS;10;19/01/2011 9:13;1,95;12422;Australia
541520;21937;STRAWBERRY   PICNIC BAG;5;19/01/2011 9:13;2,95;12422;Australia
541520;21936;RED RETROSPOT PICNIC BAG;5;19/01/2011 9:13;2,95;12422;Australia
541520;21932;SCANDINAVIAN PAISLEY PICNIC BAG;5;19/01/2011 9:13;2,95;12422;Australia
541520;20717;STRAWBERRY SHOPPER BAG;10;19/01/2011 9:13;1,25;12422;Australia
541520;22503;CABIN BAG VINTAGE PAISLEY;3;19/01/2011 9:13;12,75;12422;Australia
541520;20712;JUMBO BAG WOODLAND ANIMALS;10;19/01/2011 9:13;1,95;12422;Australia
541520;85099C;JUMBO  BAG BAROQUE BLACK WHITE;10;19/01/2011 9:13;1,95;12422;Australia
541520;22379;RECYCLING BAG RETROSPOT ;5;19/01/2011 9:13;2,1;12422;Australia
541520;22356;CHARLOTTE BAG PINK POLKADOT;10;19/01/2011 9:13;0,85;12422;Australia
541520;20727;LUNCH BAG  BLACK SKULL.;10;19/01/2011 9:13;1,65;12422;Australia
541520;22384;LUNCH BAG PINK POLKADOT;20;19/01/2011 9:13;1,65;12422;Australia
541657;22087;PAPER BUNTING WHITE LACE;6;20/01/2011 12:11;2,95;16321;Australia
541657;85123A;WHITE HANGING HEART T-LIGHT HOLDER;6;20/01/2011 12:11;2,95;16321;Australia
541657;21056;DOCTOR'S BAG SOFT TOY;3;20/01/2011 12:11;8,95;16321;Australia
541657;22960;JAM MAKING SET WITH JARS;6;20/01/2011 12:11;4,25;16321;Australia
542542;21115;ROSE CARAVAN DOORSTOP;4;28/01/2011 14:37;6,75;12431;Australia
542542;21524;DOORMAT SPOTTY HOME SWEET HOME;2;28/01/2011 14:37;7,95;12431;Australia
542542;22785;SQUARECUSHION COVER PINK UNION FLAG;4;28/01/2011 14:37;6,75;12431;Australia
542542;22786;CUSHION COVER PINK UNION JACK;4;28/01/2011 14:37;5,95;12431;Australia
542542;22192;BLUE DINER WALL CLOCK;4;28/01/2011 14:37;8,5;12431;Australia
542542;22193;RED DINER WALL CLOCK;4;28/01/2011 14:37;8,5;12431;Australia
542542;22191;IVORY DINER WALL CLOCK;4;28/01/2011 14:37;8,5;12431;Australia
542542;22726;ALARM CLOCK BAKELIKE GREEN;4;28/01/2011 14:37;3,75;12431;Australia
542542;22727;ALARM CLOCK BAKELIKE RED ;4;28/01/2011 14:37;3,75;12431;Australia
542542;22728;ALARM CLOCK BAKELIKE PINK;4;28/01/2011 14:37;3,75;12431;Australia
542542;22729;ALARM CLOCK BAKELIKE ORANGE;4;28/01/2011 14:37;3,75;12431;Australia
542542;22730;ALARM CLOCK BAKELIKE IVORY;4;28/01/2011 14:37;3,75;12431;Australia
542542;84988;SET OF 72 PINK HEART PAPER DOILIES;12;28/01/2011 14:37;1,45;12431;Australia
542542;22194;BLACK DINER WALL CLOCK;2;28/01/2011 14:37;8,5;12431;Australia
542542;21243;PINK  POLKADOT PLATE ;8;28/01/2011 14:37;1,69;12431;Australia
542542;21242;RED RETROSPOT PLATE ;8;28/01/2011 14:37;1,69;12431;Australia
542542;21245;GREEN POLKADOT PLATE ;8;28/01/2011 14:37;1,69;12431;Australia
542542;21244;BLUE POLKADOT PLATE ;8;28/01/2011 14:37;1,69;12431;Australia
542542;22467;GUMBALL COAT RACK;6;28/01/2011 14:37;2,55;12431;Australia
542542;21094;SET/6 RED SPOTTY PAPER PLATES;12;28/01/2011 14:37;0,85;12431;Australia
543357;84978;HANGING HEART JAR T-LIGHT HOLDER;12;07/02/2011 13:59;1,25;12388;Australia
543357;22960;JAM MAKING SET WITH JARS;6;07/02/2011 13:59;4,25;12388;Australia
543357;47590B;PINK HAPPY BIRTHDAY BUNTING;3;07/02/2011 13:59;5,45;12388;Australia
543357;47566;PARTY BUNTING;4;07/02/2011 13:59;4,95;12388;Australia
543357;22087;PAPER BUNTING WHITE LACE;6;07/02/2011 13:59;2,95;12388;Australia
543357;22720;SET OF 3 CAKE TINS PANTRY DESIGN ;6;07/02/2011 13:59;4,95;12388;Australia
543372;22087;PAPER BUNTING WHITE LACE;18;07/02/2011 15:01;2,95;16321;Australia
543372;22325;MOBILE VINTAGE HEARTS ;3;07/02/2011 15:01;4,95;16321;Australia
C543375;22325;MOBILE VINTAGE HEARTS ;-3;07/02/2011 15:09;4,95;16321;Australia
C543375;22087;PAPER BUNTING WHITE LACE;-18;07/02/2011 15:09;2,95;16321;Australia
543376;22325;MOBILE VINTAGE HEARTS ;3;07/02/2011 15:10;4,95;16321;Australia
543376;22087;PAPER BUNTING WHITE LACE;18;07/02/2011 15:10;2,95;16321;Australia
543989;23231;WRAP DOILEY DESIGN;200;15/02/2011 9:52;0,34;12415;Australia
543989;23230;WRAP ALPHABET DESIGN;200;15/02/2011 9:52;0,34;12415;Australia
543989;23233;WRAP POPPIES  DESIGN;100;15/02/2011 9:52;0,42;12415;Australia
543989;22989;SET 2 PANTRY DESIGN TEA TOWELS;200;15/02/2011 9:52;2,75;12415;Australia
543989;22990;COTTON APRON PANTRY DESIGN;100;15/02/2011 9:52;4,25;12415;Australia
543989;22969;HOMEMADE JAM SCENTED CANDLES;480;15/02/2011 9:52;1,25;12415;Australia
543989;22962;JAM JAR WITH PINK LID;384;15/02/2011 9:52;0,72;12415;Australia
543989;22963;JAM JAR WITH GREEN LID;240;15/02/2011 9:52;0,72;12415;Australia
543989;22960;JAM MAKING SET WITH JARS;96;15/02/2011 9:52;3,75;12415;Australia
543989;22666;RECIPE BOX PANTRY YELLOW DESIGN;96;15/02/2011 9:52;2,55;12415;Australia
543989;22907;PACK OF 20 NAPKINS PANTRY DESIGN;96;15/02/2011 9:52;0,72;12415;Australia
543989;22722;SET OF 6 SPICE TINS PANTRY DESIGN;48;15/02/2011 9:52;3,45;12415;Australia
543989;22968;ROSE COTTAGE KEEPSAKE BOX ;48;15/02/2011 9:52;8,5;12415;Australia
543989;22652;TRAVEL SEWING KIT;200;15/02/2011 9:52;1,45;12415;Australia
543989;22654;DELUXE SEWING KIT ;80;15/02/2011 9:52;4,95;12415;Australia
543989;22653;BUTTON BOX ;100;15/02/2011 9:52;1,95;12415;Australia
543989;22651;GENTLEMAN SHIRT REPAIR KIT ;288;15/02/2011 9:52;0,72;12415;Australia
543989;22630;DOLLY GIRL LUNCH BOX;256;15/02/2011 9:52;1,65;12415;Australia
543989;22662;LUNCH BAG DOLLY GIRL DESIGN;200;15/02/2011 9:52;1,45;12415;Australia
543989;22635;CHILDS BREAKFAST SET DOLLY GIRL ;16;15/02/2011 9:52;8,5;12415;Australia
543989;22029;SPACEBOY BIRTHDAY CARD;144;15/02/2011 9:52;0,36;12415;Australia
543989;22382;LUNCH BAG SPACEBOY DESIGN ;100;15/02/2011 9:52;1,45;12415;Australia
543989;22544;MINI JIGSAW SPACEBOY;240;15/02/2011 9:52;0,36;12415;Australia
543989;22613;PACK OF 20 SPACEBOY NAPKINS;96;15/02/2011 9:52;0,72;12415;Australia
543989;22629;SPACEBOY LUNCH BOX ;192;15/02/2011 9:52;1,65;12415;Australia
543989;22617;BAKING SET SPACEBOY DESIGN;72;15/02/2011 9:52;4,25;12415;Australia
543989;22634;CHILDS BREAKFAST SET SPACEBOY ;24;15/02/2011 9:52;8,5;12415;Australia
543989;22417;PACK OF 60 SPACEBOY CAKE CASES;120;15/02/2011 9:52;0,42;12415;Australia
543989;22631;CIRCUS PARADE LUNCH BOX ;128;15/02/2011 9:52;1,65;12415;Australia
543989;22556;PLASTERS IN TIN CIRCUS PARADE ;96;15/02/2011 9:52;1,45;12415;Australia
543989;22716;CARD CIRCUS PARADE;144;15/02/2011 9:52;0,36;12415;Australia
543989;22636;CHILDS BREAKFAST SET CIRCUS PARADE;24;15/02/2011 9:52;7,65;12415;Australia
543989;22423;REGENCY CAKESTAND 3 TIER;64;15/02/2011 9:52;10,95;12415;Australia
543989;22699;ROSES REGENCY TEACUP AND SAUCER ;72;15/02/2011 9:52;2,55;12415;Australia
543989;22698;PINK REGENCY TEACUP AND SAUCER;72;15/02/2011 9:52;2,55;12415;Australia
543989;22697;GREEN REGENCY TEACUP AND SAUCER;72;15/02/2011 9:52;2,55;12415;Australia
543989;84997B;RED 3 PIECE RETROSPOT CUTLERY SET;72;15/02/2011 9:52;3,75;12415;Australia
543989;21080;SET/20 RED RETROSPOT PAPER NAPKINS ;192;15/02/2011 9:52;0,72;12415;Australia
543989;21086;SET/6 RED SPOTTY PAPER CUPS;216;15/02/2011 9:52;0,53;12415;Australia
543989;21094;SET/6 RED SPOTTY PAPER PLATES;288;15/02/2011 9:52;0,64;12415;Australia
543989;21210;SET OF 72 RETROSPOT PAPER  DOILIES;192;15/02/2011 9:52;1,25;12415;Australia
543989;21216;SET 3 RETROSPOT TEA,COFFEE,SUGAR;72;15/02/2011 9:52;4,25;12415;Australia
543989;21212;PACK OF 72 RETROSPOT CAKE CASES;120;15/02/2011 9:52;0,42;12415;Australia
543989;21217;RED RETROSPOT ROUND CAKE TINS;48;15/02/2011 9:52;8,95;12415;Australia
543989;21880;RED RETROSPOT TAPE;72;15/02/2011 9:52;0,65;12415;Australia
543989;22139;RETROSPOT TEA SET CERAMIC 11 PC ;96;15/02/2011 9:52;4,25;12415;Australia
543989;22333;RETROSPOT PARTY BAG + STICKER SET;192;15/02/2011 9:52;1,45;12415;Australia
543989;22329;ROUND CONTAINER SET OF 5 RETROSPOT;144;15/02/2011 9:52;1,45;12415;Australia
543989;22505;MEMO BOARD COTTAGE DESIGN;24;15/02/2011 9:52;4,25;12415;Australia
543989;22628;PICNIC BOXES SET OF 3 RETROSPOT ;120;15/02/2011 9:52;4,25;12415;Australia
543989;22667;RECIPE BOX RETROSPOT ;24;15/02/2011 9:52;2,55;12415;Australia
543989;21218;RED SPOTTY BISCUIT TIN;96;15/02/2011 9:52;3,25;12415;Australia
543989;22840;ROUND CAKE TIN VINTAGE RED;12;15/02/2011 9:52;6,95;12415;Australia
543989;22841;ROUND CAKE TIN VINTAGE GREEN;12;15/02/2011 9:52;6,95;12415;Australia
543989;22842;BISCUIT TIN VINTAGE RED;12;15/02/2011 9:52;5,95;12415;Australia
543989;22843;BISCUIT TIN VINTAGE GREEN;12;15/02/2011 9:52;5,95;12415;Australia
543989;21164;HOME SWEET HOME METAL SIGN ;72;15/02/2011 9:52;2,55;12415;Australia
543989;21249;WOODLAND  HEIGHT CHART STICKERS ;60;15/02/2011 9:52;2,55;12415;Australia
543989;20726;LUNCH BAG WOODLAND;100;15/02/2011 9:52;1,45;12415;Australia
543989;22331;WOODLAND PARTY BAG + STICKER SET;144;15/02/2011 9:52;1,45;12415;Australia
543989;20973;12 PENCIL SMALL TUBE WOODLAND;384;15/02/2011 9:52;0,55;12415;Australia
543989;22326;ROUND SNACK BOXES SET OF4 WOODLAND ;96;15/02/2011 9:52;2,55;12415;Australia
543989;21058;PARTY INVITES WOODLAND;144;15/02/2011 9:52;0,72;12415;Australia
543989;22835;HOT WATER BOTTLE I AM SO POORLY;8;15/02/2011 9:52;4,65;12415;Australia
543989;84029G;KNITTED UNION FLAG HOT WATER BOTTLE;8;15/02/2011 9:52;3,75;12415;Australia
543989;21195;PINK  HONEYCOMB PAPER BALL ;48;15/02/2011 9:52;1,69;12415;Australia
543989;21191;LARGE WHITE HONEYCOMB PAPER BELL  ;48;15/02/2011 9:52;1,69;12415;Australia
543989;21192;WHITE BELL HONEYCOMB PAPER ;48;15/02/2011 9:52;1,45;12415;Australia
543989;21977;PACK OF 60 PINK PAISLEY CAKE CASES;120;15/02/2011 9:52;0,42;12415;Australia
545065;22992;REVOLVER WOODEN RULER ;24;27/02/2011 14:43;1,95;12431;Australia
545065;21731;RED TOADSTOOL LED NIGHT LIGHT;144;27/02/2011 14:43;1,45;12431;Australia
545065;22505;MEMO BOARD COTTAGE DESIGN;4;27/02/2011 14:43;4,95;12431;Australia
545065;21937;STRAWBERRY   PICNIC BAG;5;27/02/2011 14:43;2,95;12431;Australia
545065;21936;RED RETROSPOT PICNIC BAG;5;27/02/2011 14:43;2,95;12431;Australia
545065;22785;SQUARECUSHION COVER PINK UNION FLAG;4;27/02/2011 14:43;6,75;12431;Australia
545065;22786;CUSHION COVER PINK UNION JACK;2;27/02/2011 14:43;5,95;12431;Australia
545065;21933;PINK VINTAGE PAISLEY PICNIC BAG;5;27/02/2011 14:43;2,95;12431;Australia
545065;21555;CERAMIC STRAWBERRY TRINKET TRAY;12;27/02/2011 14:43;2,55;12431;Australia
545065;22466;FAIRY TALE COTTAGE NIGHTLIGHT;12;27/02/2011 14:43;1,95;12431;Australia
545475;22978;PANTRY ROLLING PIN;72;03/03/2011 10:59;3,39;12415;Australia
545475;22980;PANTRY SCRUBBING BRUSH;144;03/03/2011 10:59;1,45;12415;Australia
545475;22993;SET OF 4 PANTRY JELLY MOULDS;144;03/03/2011 10:59;1,06;12415;Australia
545475;22654;DELUXE SEWING KIT ;80;03/03/2011 10:59;4,95;12415;Australia
545475;22968;ROSE COTTAGE KEEPSAKE BOX ;24;03/03/2011 10:59;8,5;12415;Australia
545475;22505;MEMO BOARD COTTAGE DESIGN;24;03/03/2011 10:59;4,25;12415;Australia
545475;22539;MINI JIGSAW DOLLY GIRL;240;03/03/2011 10:59;0,36;12415;Australia
545475;22630;DOLLY GIRL LUNCH BOX;256;03/03/2011 10:59;1,65;12415;Australia
545475;22662;LUNCH BAG DOLLY GIRL DESIGN;100;03/03/2011 10:59;1,45;12415;Australia
545475;22635;CHILDS BREAKFAST SET DOLLY GIRL ;24;03/03/2011 10:59;8,5;12415;Australia
545475;22708;WRAP DOLLY GIRL;200;03/03/2011 10:59;0,34;12415;Australia
545475;22423;REGENCY CAKESTAND 3 TIER;32;03/03/2011 10:59;10,95;12415;Australia
545475;22699;ROSES REGENCY TEACUP AND SAUCER ;24;03/03/2011 10:59;2,55;12415;Australia
545475;84997B;CHILDRENS CUTLERY RETROSPOT RED ;72;03/03/2011 10:59;3,75;12415;Australia
545475;21080;SET/20 RED RETROSPOT PAPER NAPKINS ;96;03/03/2011 10:59;0,72;12415;Australia
545475;21086;SET/6 RED SPOTTY PAPER CUPS;216;03/03/2011 10:59;0,53;12415;Australia
545475;21094;SET/6 RED SPOTTY PAPER PLATES;96;03/03/2011 10:59;0,64;12415;Australia
545475;21216;SET 3 RETROSPOT TEA,COFFEE,SUGAR;120;03/03/2011 10:59;4,25;12415;Australia
545475;21217;RED RETROSPOT ROUND CAKE TINS;120;03/03/2011 10:59;8,95;12415;Australia
545475;22083;PAPER CHAIN KIT RETROSPOT;80;03/03/2011 10:59;2,55;12415;Australia
545475;22090;PAPER BUNTING RETROSPOT;80;03/03/2011 10:59;2,55;12415;Australia
545475;21218;RED SPOTTY BISCUIT TIN;120;03/03/2011 10:59;3,25;12415;Australia
545475;20677;PINK POLKADOT BOWL;144;03/03/2011 10:59;1,06;12415;Australia
545475;21239;PINK  POLKADOT CUP;96;03/03/2011 10:59;0,72;12415;Australia
545475;21240;BLUE POLKADOT CUP;96;03/03/2011 10:59;0,72;12415;Australia
545475;21243;PINK  POLKADOT PLATE ;96;03/03/2011 10:59;1,45;12415;Australia
545475;21244;BLUE POLKADOT PLATE ;96;03/03/2011 10:59;1,45;12415;Australia
545475;21238;RED RETROSPOT CUP;96;03/03/2011 10:59;0,72;12415;Australia
545475;22842;BISCUIT TIN VINTAGE RED;48;03/03/2011 10:59;5,95;12415;Australia
545475;22841;ROUND CAKE TIN VINTAGE GREEN;36;03/03/2011 10:59;6,95;12415;Australia
545475;22840;ROUND CAKE TIN VINTAGE RED;36;03/03/2011 10:59;6,95;12415;Australia
545475;22838;3 TIER CAKE TIN RED AND CREAM;20;03/03/2011 10:59;14,95;12415;Australia
545475;22839;3 TIER CAKE TIN GREEN AND CREAM;32;03/03/2011 10:59;12,75;12415;Australia
545475;22846;BREAD BIN DINER STYLE RED ;16;03/03/2011 10:59;14,95;12415;Australia
545475;22849;BREAD BIN DINER STYLE MINT;8;03/03/2011 10:59;14,95;12415;Australia
545475;22848;BREAD BIN DINER STYLE PINK;8;03/03/2011 10:59;14,95;12415;Australia
545475;22666;RECIPE BOX PANTRY YELLOW DESIGN;72;03/03/2011 10:59;2,55;12415;Australia
545475;22960;JAM MAKING SET WITH JARS;120;03/03/2011 10:59;3,75;12415;Australia
545475;22961;JAM MAKING SET PRINTED;96;03/03/2011 10:59;1,25;12415;Australia
545475;22969;HOMEMADE JAM SCENTED CANDLES;288;03/03/2011 10:59;1,25;12415;Australia
545475;21508;VINTAGE KID DOLLY CARD ;72;03/03/2011 10:59;0,36;12415;Australia
545475;21509;COWBOYS AND INDIANS BIRTHDAY CARD ;144;03/03/2011 10:59;0,36;12415;Australia
545475;22027;TEA PARTY BIRTHDAY CARD;144;03/03/2011 10:59;0,36;12415;Australia
545475;22029;SPACEBOY BIRTHDAY CARD;72;03/03/2011 10:59;0,36;12415;Australia
545475;22714;CARD BIRTHDAY COWBOY;144;03/03/2011 10:59;0,36;12415;Australia
545475;22035;VINTAGE CARAVAN GREETING CARD ;72;03/03/2011 10:59;0,36;12415;Australia
545475;22715;CARD WEDDING DAY;144;03/03/2011 10:59;0,36;12415;Australia
545475;22046;TEA PARTY  WRAPPING PAPER ;200;03/03/2011 10:59;0,34;12415;Australia
545475;22636;CHILDS BREAKFAST SET CIRCUS PARADE;24;03/03/2011 10:59;7,65;12415;Australia
545475;22631;CIRCUS PARADE LUNCH BOX ;128;03/03/2011 10:59;1,65;12415;Australia
545475;22615;PACK OF 12 CIRCUS PARADE TISSUES ;432;03/03/2011 10:59;0,25;12415;Australia
545475;22555;PLASTERS IN TIN STRONGMAN;288;03/03/2011 10:59;1,45;12415;Australia
545475;22551;PLASTERS IN TIN SPACEBOY;192;03/03/2011 10:59;1,45;12415;Australia
545475;22556;PLASTERS IN TIN CIRCUS PARADE ;192;03/03/2011 10:59;1,45;12415;Australia
545475;22557;PLASTERS IN TIN VINTAGE PAISLEY ;96;03/03/2011 10:59;1,45;12415;Australia
545475;21984;PACK OF 12 PINK PAISLEY TISSUES ;432;03/03/2011 10:59;0,25;12415;Australia
545475;21981;PACK OF 12 WOODLAND TISSUES ;432;03/03/2011 10:59;0,25;12415;Australia
545475;22093;MOTORING TISSUE BOX;36;03/03/2011 10:59;1,06;12415;Australia
545475;22045;SPACEBOY GIFT WRAP;200;03/03/2011 10:59;0,34;12415;Australia
545475;22382;LUNCH BAG SPACEBOY DESIGN ;100;03/03/2011 10:59;1,45;12415;Australia
545475;22629;SPACEBOY LUNCH BOX ;320;03/03/2011 10:59;1,65;12415;Australia
545475;22634;CHILDS BREAKFAST SET SPACEBOY ;24;03/03/2011 10:59;8,5;12415;Australia
545475;22617;BAKING SET SPACEBOY DESIGN;48;03/03/2011 10:59;4,25;12415;Australia
545475;22541;MINI JIGSAW LEAP FROG;240;03/03/2011 10:59;0,36;12415;Australia
545475;22540;MINI JIGSAW CIRCUS PARADE ;240;03/03/2011 10:59;0,36;12415;Australia
545475;21915;RED  HARMONICA IN BOX ;240;03/03/2011 10:59;1,06;12415;Australia
545475;21914;BLUE HARMONICA IN BOX ;240;03/03/2011 10:59;1,06;12415;Australia
545475;22271;FELTCRAFT DOLL ROSIE;96;03/03/2011 10:59;2,55;12415;Australia
545475;22272;FELTCRAFT DOLL MARIA;48;03/03/2011 10:59;2,55;12415;Australia
545475;22273;FELTCRAFT DOLL MOLLY;96;03/03/2011 10:59;2,55;12415;Australia
